{
  "id": "happiness-marginal-utility",
  "title": "快乐的边际效用",
  "chapter": "01-mindset",
  "tags": ["心态", "幸福", "消费"],
  "question_patterns": [
    "快乐和金钱的关系",
    "边际效用是什么意思",
    "买东西会让我更快乐吗",
    "为什么赚钱越多快乐提升越慢"
  ],
  "answer": {
    "summary": "随着你拥有的更多，额外的钱带来的快乐会逐渐减少。",
    "core_concept": "边际效用说明第一笔钱通常带来最大的安全感和满足感，第二笔、第三笔的增量效应逐渐减弱。",
    "formula": "快乐增量 = 总快乐 ÷ 额外收入",
    "example": {
      "scenario": "小李用第一万元支付房租，第二万元买了旅行，第三万元购买高档电子产品。",
      "calculation": "第一万元快乐=8/10，第二万元快乐=6/10，第三万元快乐=3/10",
      "explanation": "基础需求被满足后，额外消费的快乐递减，说明理财应优先关注稳固基础，而不是无限追求更高收入。"
    },
    "limitations": [
      "快乐的主观体验因人而异",
      "并非所有支出都遵循递减规律（例如健康投资）",
      "边际效用只是帮助判断优先级，不是绝对标准"
    ]
  },
  "action_item": "记录本周的三笔支出，并评估每笔支出是否是真正带来持续价值的消费。",
  "related_nodes": [
    "what-is-financial-freedom",
    "money-as-tool",
    "emergency-fund"
  ],
  "source": {
    "primary": "行为经济学与理财心态",
    "books": ["《白领1000万财务自由笔记》", "《聪明钱》"]
  }
}
