{
  "id": "investment-psychology",
  "title": "投资心理学",
  "chapter": "04-allocation",
  "tags": ["心理", "行为金融", "决策", "情绪"],
  "question_patterns": [
    "为什么散户总是亏钱",
    "投资时怎么控制情绪",
    "什么是行为金融学",
    "如何避免追涨杀跌",
    "投资心理有哪些陷阱"
  ],
  "answer": {
    "summary": "投资最大的敌人不是市场，而是你自己。行为金融学研究发现，人在金钱面前的非理性决策是可以预测的——认识这些陷阱，是长期投资成功的关键。",
    "core_concept": "人有两套思维系统：快速的情绪反应（系统1）和慢速的理性分析（系统2）。市场下跌时，系统1让你恐慌抛售；市场上涨时，让你盲目追高。投资成功需要训练系统2来监督系统1。",
    "formula": "实际收益 = 市场收益 + 行为溢价（正向或负向）",
    "example": {
      "scenario": "2015年股灾期间，许多散户在沪深300从5800点跌到3000点时割肉离场，损失约50%。",
      "calculation": "损失 = 恐慌卖出 × (1 - 后续反弹幅度)。坚持不卖持有到2024年，沪深300回到4000点，实际亏损已大幅收窄。",
      "explanation": "恐慌时的决策（系统1）让你在最低点卖出，完美错过反弹。逆向操作（系统2主导）才是长期制胜之道。"
    },
    "limitations": [
      "知道心理陷阱不等于能避免",
      "极端市场环境下情绪控制更难",
      "理性决策需要数据和纪律支撑，缺一不可"
    ]
  },
  "action_item": "记录你每次想买卖时的情绪状态：是恐慌？是兴奋？还是经过计算的？如果是情绪驱动，先等24小时再决定。",
  "related_nodes": [
    "dollar-cost-averaging",
    "compound-interest",
    "money-as-tool"
  ],
  "source": {
    "primary": "行为金融学",
    "books": ["《思考，快与慢》", "《错误的行为》", "《金钱心理学》"],
    "references": [
      "Kahneman & Tversky 前景理论 (1979)",
      "Dalbar QAIBT研究 (美国散户收益长期跑输指数)"
    ]
  }
}