{
  "id": "geo-arbitrage",
  "title": "地理套利",
  "chapter": "06-freedom",
  "tags": ["地理套利", "成本节省", "自由"],
  "question_patterns": [
    "什么是地理套利",
    "搬到生活成本低的城市",
    "如何通过搬家省钱",
    "远程工作和生活成本"
  ],
  "answer": {
    "summary": "地理套利是通过选择生活成本低的地点，提高同样收入的实际购买力。",
    "core_concept": "如果你的收入来源于全球市场或远程工作，那么居住地的差异可以成为你的优势。",
    "formula": "实际购买力 = 收入 ÷ 生活成本指数",
    "example": {
      "scenario": "小张收入3万，A地生活成本指数120，B地为80。",
      "calculation": "A地购买力=3万÷120=250；B地购买力=3万÷80=375",
      "explanation": "在B地，同样收入能换取更高生活质量和储蓄能力。"
    },
    "limitations": [
      "地理套利可能带来社交和适应成本",
      "收入来源必须相对稳定且可远程",
      "不同地区法律和税收也需考虑"
    ]
  },
  "action_item": "列出你所在城市与目标低成本城市的生活成本差异，评估是否值得搬迁或调整生活方式。",
  "related_nodes": [
    "fire-types",
    "withdrawal-strategies",
    "dual-wheel-allocation"
  ],
  "source": {
    "primary": "地理与成本优化策略",
    "books": ["《聪明钱》", "《白领1000万财务自由笔记》"]
  }
}
