{
  "id": "money-as-tool",
  "title": "钱是工具，不是目的",
  "chapter": "01-mindset",
  "tags": ["心态", "价值观", "目标"],
  "question_patterns": [
    "钱是工具吗",
    "如何看待金钱",
    "钱的真正作用",
    "为什么不要以钱为目的"
  ],
  "answer": {
    "summary": "钱本身不是目标，而是实现自由、选择和安全的工具。",
    "core_concept": "把钱当成工具，就不会把财富本身当成幸福来源。你用钱去买时间、安全、学习和健康，而不是为了积累数字。",
    "formula": "幸福 = 有意义的目标 + 足够的资源 × 自由度",
    "example": {
      "scenario": "小张每月收入2万元，他把一部分用于生活，一部分用于学习和旅行。",
      "calculation": "收入=2万，储蓄=5000，学习+体验=5000，生活=1万",
      "explanation": "他不是为了赚更多的钱而工作，而是用钱支持自己想要的生活方式。"
    },
    "limitations": [
      "金钱不能解决所有问题，比如人际关系和健康",
      "工具思维需要长期实践，不是一夜改变",
      "资源不足时仍需先满足基本生活需求"
    ]
  },
  "action_item": "写下你现在最想改善的三件事，思考每件事是否真的需要更多收入，还是需要更好的规划。",
  "related_nodes": [
    "what-is-financial-freedom",
    "income-growth-framework",
    "savings-rate"
  ],
  "source": {
    "primary": "FIRE 社区价值观",
    "books": ["《聪明钱》", "《白领1000万财务自由笔记》"]
  }
}
