{
  "id": "customize-path-for-debt",
  "title": "有负债如何调整学习路径？",
  "chapter": "07-learning-path",
  "tags": ["债务", "路径调整", "debt", "customization"],
  "question_patterns": [
    "我有负债该怎么开始",
    "欠债还能财务自由吗",
    "先还债还是先投资"
  ],
  "answer": {
    "summary": "如果你有高息债务（年利率>6%），应在初学者阶段优先还清，应急基金可暂降至1个月支出。",
    "core_concept": "债务分为好债（低息房贷、助学贷）和坏债（信用卡分期、网贷）。坏债会侵蚀储蓄率，必须先消灭。还清坏债后，再按标准路径建立应急基金和投资。",
    "formula": "建议应急基金 = 1个月支出（还债期间）",
    "example": {
      "scenario": "小王有2万元信用卡分期，年利率15%，月支出5000元。",
      "calculation": "小王应先存5000元作为最低应急基金，然后全力偿还信用卡。还清后，再按标准路径将应急基金补充至3-6个月。",
      "explanation": "15%的利息远高于投资预期回报，还债等于获得15%的无风险收益。"
    },
    "limitations": ["若有房贷等低息债务，无需急于还清，可同步投资"]
  },
  "action_item": "列出你所有债务及对应利率，将利率>6%的标红，制定还款优先级。",
  "related_nodes": ["good-debt-vs-bad-debt", "emergency-fund", "savings-rate"],
  "source": {
    "primary": "FIRE社区通用建议",
    "books": ["《聪明钱》债务篇"]
  }
}
