{
  "id": "stock-bond-balance",
  "title": "股票与债券平衡",
  "chapter": "04-allocation",
  "tags": ["股票", "债券", "平衡"],
  "question_patterns": [
    "股票债券怎么分配",
    "60/40组合是什么意思",
    "风险资产和安全资产比例",
    "长期投资组合如何配置"
  ],
  "answer": {
    "summary": "股票和债券的平衡配置能在追求收益的同时降低整体波动。",
    "core_concept": "股票带来长期增长，债券提供稳定现金流。合理比例取决于你的风险承受力和目标期限。",
    "formula": "组合收益 ≈ 股票收益 × 股票权重 + 债券收益 × 债券权重",
    "example": {
      "scenario": "60%股票、40%债券组合，假设股票回报8%、债券回报3%。",
      "calculation": "组合收益=0.6×8%+0.4×3%=5.6%+1.2%=6.8%",
      "explanation": "这样的组合比纯股票更稳，但仍能获得较好长期回报。"
    },
    "limitations": [
      "实际收益受市场波动影响",
      "固定比例不一定适合所有阶段",
      "债券也有利率和信用风险"
    ]
  },
  "action_item": "根据你的年龄和目标，写出一个股票/债券目标比例，并记录为什么选择这个比例。",
  "related_nodes": ["asset-allocation-basics", "dual-wheel-allocation", "rebalancing"],
  "source": {
    "primary": "经典资产配置原则",
    "books": ["《聪明钱》", "《让钱去工作》"]
  }
}
