{
  "id": "what-is-financial-freedom",
  "title": "什么是财务自由？",
  "chapter": "01-mindset",
  "tags": ["定义", "FIRE", "被动收入"],
  "question_patterns": [
    "什么是财务自由",
    "财务自由的定义",
    "怎样才算财务自由",
    "财务独立是什么意思"
  ],
  "answer": {
    "summary": "财务自由是指你的被动收入能够完全覆盖日常开支。那一刻起，你不再为钱而工作，而是让钱为你工作。",
    "core_concept": "财务自由 ≠ 拥有巨额财富。它更关乎你与金钱关系的改变：你从金钱的奴隶，变成金钱的主人。被动收入可以来自投资股息、房租、版权、生意分红等无需你用时间直接换取的收入。",
    "formula": "被动收入 ≥ 日常总支出",
    "example": {
      "scenario": "小王每月生活开支为8000元。他通过指数基金分红、房租等每月获得9000元被动收入。",
      "calculation": "被动收入9000元 - 支出8000元 = 1000元正向现金流",
      "explanation": "他的被动收入超过生活支出，说明他已经实现了现金流意义上的财务自由。"
    },
    "limitations": [
      "此定义仅关注现金流，未计算资产增值",
      "个人对'体面生活'的标准不同",
      "通货膨胀会逐步提高支出门槛"
    ]
  },
  "action_item": "打开手机备忘录，写下你过去3个月的平均月支出。这是你迈向财务自由需要知道的第一个数字。",
  "related_nodes": [
    "four-percent-rule",
    "passive-income-types",
    "net-worth-calculation"
  ],
  "source": {
    "primary": "FIRE社区基础定义",
    "books": ["《聪明钱》第一章", "《白领1000万财务自由笔记》"]
  }
}
