{
  "id": "emergency-fund",
  "title": "应急基金",
  "chapter": "02-foundation",
  "tags": ["储蓄", "安全", "基础", "现金"],
  "question_patterns": [
    "什么是应急基金",
    "应急基金多少钱合适",
    "为什么需要应急基金",
    "应急基金怎么建"
  ],
  "answer": {
    "summary": "应急基金是3-6个月生活费的现金储备，用于应对意外支出，如失业、医疗或紧急维修。",
    "core_concept": "应急基金让你在财务危机时不依赖信用卡或高息贷款。它是财务自由的基础，确保你在追求投资回报前，先有安全网。",
    "formula": "应急基金金额 = 月支出 × 3-6个月",
    "example": {
      "scenario": "每月生活开支8000元，建议建3-6个月应急基金。",
      "calculation": "8000元 × 3 = 2.4万元；8000元 × 6 = 4.8万元",
      "explanation": "准备2.4万到4.8万元现金，存放在高息活期或货币基金中，随时可取。"
    },
    "limitations": [
      "金额因个人情况调整（如工作稳定性）",
      "通胀会降低现金价值",
      "过度保守可能错失投资机会"
    ]
  },
  "action_item": "计算你的月支出，乘以3，存入高息账户，开始积累应急基金。",
  "related_nodes": [
    "savings-rate",
    "net-worth-calculation"
  ],
  "source": {
    "primary": "财务规划基础原则",
    "books": ["《聪明钱》", "《白领1000万财务自由笔记》", "《让钱去工作》"]
  }
}