{
  "id": "four-percent-rule",
  "title": "4%法则",
  "chapter": "06-freedom",
  "tags": ["FIRE", "退休", "安全提取", "投资"],
  "question_patterns": [
    "什么是4%法则",
    "4%规则如何工作",
    "FIRE的4%法则",
    "如何计算退休所需资金"
  ],
  "answer": {
    "summary": "4%法则是一种安全提取策略，建议从投资组合中每年提取不超过4%的资金，以确保退休金在30年内不会耗尽。",
    "core_concept": "基于历史股市数据（1926-1976年），4%是可持续提取的最高比例。每年提取4%，并根据通胀调整，可以让你的退休金持续更久，而不会提前耗尽。",
    "formula": "所需退休资金 = 年支出 ÷ 0.04",
    "example": {
      "scenario": "假设你每年生活开支为5万元。",
      "calculation": "5万元 ÷ 0.04 = 125万元",
      "explanation": "你需要准备125万元的退休金。按照4%法则，每年提取5万元，并随通胀调整提取金额。"
    },
    "limitations": [
      "基于历史数据，不保证未来市场表现",
      "假设投资组合为60%股票/40%债券",
      "未考虑税收、遗产或特殊医疗支出"
    ]
  },
  "action_item": "计算你过去一年的平均年支出，然后除以0.04，得到你的财务自由目标净资产。",
  "related_nodes": ["fire-types", "dual-wheel-allocation", "savings-rate"],
  "source": {
    "primary": "Trinity Study (1998)",
    "books": ["《聪明钱》", "《白领1000万财务自由笔记》", "《让钱去工作》"],
    "references": [
      "https://www.ssrn.com/index.cfm/en/ssrn-id/116183/ (Trinity Study)",
      "https://earlyretirementnow.com/series/safe-withdrawal-rate-5/ (Big ERN SWR series)",
      "https://investor.vanguard.com/investor-resources-education/market-outlook (Vanguard annual outlook)"
    ]
  }
}
